kor_context,eng_context
안타깝지만 데려다 주는 건 <br>여기까지요.<br>,Unfortunately<c> that's all it takes<br>to get you.<br>
미안하군.<br>도시에 더 이상 가까이<br>가는 건 너무 위험해.<br>,I'm sorry.<br>It's too dangerous to get any closer<br>to the city.<br>
물론<c> 자네같은 여사제에게는<br>문제될 것 없겠지만.<br>,Of course<c> it won't be a problem<br>for a priestess like you.<br>
나뭇잎으로 싸우다니<br>상당히 힘들겠는데<..>.<br>,It would be very difficult to fight<br>with the leaves<..>.<br>
하지만 자네가 저주를<br>막아낼 거라고 믿네.<br>,But I do believe you will<br>stop the curse.<br>
자네가 사는 땅까지<br>퍼지지 않았는가.<br>,Didn't it spread to the land where<br>you live?<br>
지금 자네에게 최선의 선택은<br>여왕 폐하를 뵙는 것이야.<br>,Your best option now is to see<br>Your Majesty the Queen.<br>
